Title,Company,Location,Link,Review,Salary,Description,Date Added,Applied
GRADUATE - DATA ANALYST - LONDON,EXPEDIA GROUP,LONDON EC1V 1NS,https://www.indeed.co.uk/rc/clk?jk=3a4c86ac99854ffc&fccid=160efb82f2462f14&vjs=3,3.9,None,"are you excited by the opportunity to pioneer the future of travel? do you want to redefine customer and partner travel experiences? are you ready to fuel industry change and jumpstart your career in data analytics? expedia group paves the way for early career talent to go far, fast with accelerated career advancement, unparalleled access to leadership and a culture of exceptional acceptance.
travel is so much more than simply reaching your destination. along your journey you will make an immediate impact on reimagining travel by developing insightful reports on traveller trends which drive operational improvements in a way that serves our goal to bring the world within reach. from consulting with internal clients and influencing business decisions, to ab testing hypotheses, there is no shortage of opportunities for technical innovation at expedia group – the sky’s the limit!
applications to this opportunity are considered for our london office.
what you’ll do:
you will partner with internal clients using a consultative approach to understand business problems, identifying the team's key challenges, provide/prototype solutions, and help solve using statistical analysis and tools
you'll work to define and decipher problems by using available data and making reasonable assumptions and will turn mounds of data into actionable insights to help drive improvements for customers, for the business, and for our operations
identify data sources, and correlate data across them, to develop insights that drive operational improvements
you will have the ability to support, influence and challenge business decisions with data and timely & insightful analyses
you will communicate analysis findings and recommendations to various levels including organization leadership in a clear, concise, and influential manner
you will become a data guru - you'll become the point of contact for data questions and insights
you'll turn data-based findings and insights into hypotheses for ab testing through analytical rigor
you'll monitor engagement and conversion trends across the network, identify breaks in trends, understand underlying drivers, and surface opportunities and threats
you'll develop self-service reporting for product and development teams, by collecting and integrating data from various sources, including web analytics tools and internal databases
present a holistic analysis to analytics and business leadership
who you are:
currently pursuing a bachelor’s or master’s degree in an analytical field such as: computer science, marketing science, statistics, mathematics, analytics, economics, business
graduating in 2021
demonstrated experience solving problems with data querying using sql, statistics and modeling in classes, projects or prior work experience
strong analytical skills, self-motivation and the capacity to work under pressure and tight deadlines
skills in tableau, r, python are a bonus for data transformation, analysis and visualization
some exciting projects interns have worked on:
season occupancy tableau report: our intern built a report that allows easy access to understand occupancy by top markets. this helps partner success and marketing focus on which markets they need to procure additional listings
traveler conversion tableau analysis: another intern built a report that shows traveler conversion by market for length of stay and leadtime. this allowed our product team to narrow in on specific traveler use cases that needed product improvement to drive conversion
partner acceptance tableau analysis: we asked our intern to build a report that showed partner acceptance by market for length of stay and leadtime. this allowed our partner product team to narrow in on specific traveler use cases that needed product improvement to drive partner acceptance
identify peak events for market maker: this report systematically identified the days in all 44 flywheel markets that had the highest adr, and the event that occurred that day. this data will be input into market maker and allow for smarter pricing, helping to increase net booked value
new customer market profiling: an intern built a methodology to define the customer lifetime value for new customers acquired in specific travel markets and used unsupervised machine learning clustering to define the most valuable clusters of markets to be used in prioritizing acquisition campaigns.
you’ve applied, now what?
we will review your application and if you are considered a fit, we will invite you to take an online assessment. those who pass the assessment will be invited for a final interview.
graduate start date:
august 23, 2021
why join us?
expedia group recognizes our success is dependent on the success of our people. we are a global travel platform, made up of the most knowledgeable, passionate, and creative people in our business. our brands recognize the power of travel to break down barriers and bring the world within reach – that responsibility inspires us to be the place where exceptional people want to do their best work, and to provide them the tools to do so.
whether you're applying to work in engineering or customer support, marketing or lodging supply, at expedia group we act as one team, working towards a common goal; to bring the world within reach. we relentlessly strive for better, but not at the cost of the customer. we act with humility and optimism, respecting ideas big and small. we value diversity and voices of all volumes. we are a global organization but keep our feet on the ground so we can act fast and stay simple. our teams also have the chance to give back on a local level and make a difference through our corporate social responsibility program, expedia cares.
if you have a hunger to make a difference with one of the most loved brands in the world and to work in the dynamic travel industry, this is the job for you.
our family of travel brands includes: brand expedia®, hotels.com®, expedia® partner solutions, egencia®, trivago®, vrbo®, orbitz®, travelocity®, wotif®, ebookers®, cheaptickets®, hotwire®, expedia® media solutions, carrentals.com™, expedia local expert®, expedia cruises™ and silverrail technologies, inc. for more information, visit www.expediagroup.com.

#li-ac3
expedia is committed to creating an inclusive work environment with a diverse workforce. all qualified applicants will receive consideration for employment without regard to race, religion, gender, sexual orientation, national origin, disability or age.",2020-09-27,0.0
MACHINE LEARNING ENGINEER - GRADUATE / INTERN,SATISAI,HOME BASED,https://www.indeed.co.uk/rc/clk?jk=fb684314ea74bca1&fccid=17743f3dc4f29246&vjs=3,None,None,"satis.ai is an early stage food tech company which uses deep learning-based computer vision, causal inference, and cognitive ai to change how we feed the people around the world. we are starting by providing software services to existing restaurant chains which use the live camera feed to provide augmentation for staff tasks with aim to help decision making, reduce error and cognitive load needed. this position us as the full stack ai operating system for autonomous kitchens. we are surfing on the opportunity created by the food delivery disruption to bring real technological innovation into kitchens and enhance both people's experiences as well as staff and environmental impact.

our mission is to feed the world through our global food system which is more productive, resilient, more affordable, more sustainable, and healthier. a food system that provides accessible nutrition for everyone while preserving our planet. satis.ai team includes people with extensive experience on the creation and deployment of scalable deep tech solutions as well as industry experts who share a passion for food, happiness and our world.

we are hiring our initial extended team to expand the science and technology arms in satis.ai. they will be responsible for developing the scalable and extendable product, which are utilised with the pilots we have with global restaurant chains. you will drive a specific agenda in a self-powered environment with autonomy, along with other brilliant members of the team, all passionate to make an impact.


the role
solve research and clients’ challenges in the field of computer vision using deep learning methods.
implement and modify machine learning methods using best software development practices.
train, analyse and report model performance.
develop tools for further automating research and analysis.
the role involves pushing the boundaries of what deep learning can do, by following and building upon the latest research in the context of object detection, classification and semantic segmentation.
you will be joining an early-stage startup with the ability to shape our future direction both for our research and for the solutions we deliver to customers.
you will participate in building a world-class product as well as the technical team responsible for developing an intelligent solution that how people around the world are fed
you are in creating the underlying ai platforms that are used for storing data, annotating data, training models and run inference at scale for thousands of video streams and provide real-time actionable insights to help monitor and capture resources at scale.you will develop solutions and integration with hardware to assist our clients and stakeholders

on offer:
flexible-working
huge emphasis on support and learning
open to remote working
unlimited fresh fruit, tea, coffee and healthy snacks provided

working with us:
mission-driven - we are dedicated to bringing nutritious, environmentally friendly and most important of all, enjoyable food for all people around the world.
ambitious - we strive to be the best at what we do.
proactive and positive - we are pragmatic and self-driven. we iterate quickly, typically in 1-month cycles.
adaptable - we embrace change and uncertainty and work together to adapt to new situations.
flexible working - we have flexible working arrangements and encourage efficient work - not more work.
low ego culture - we are open to feedback and treat everyone with respect. we assume the best intent from others.
inclusive - we are open-minded and don’t just accept diversity - we celebrate it and support it.

required skills and experience:
self learner/ educated of tensorflow or other deep learning libraries (pytorch, keras)
experienced in using object-oriented programming languages like python, java, c++ (or others)
self learner/ educated in machine learning methods, such as active learning, clustering, semi-supervised learning, zero- and few-shot learning
exisiting hands-on experience ofsoftware development skills in python (numpy, scipy, scikit-learn, opencv) and familiarity with c++
fimiliar with mlops concepts and systems used
analytical mindset, strong abstract thinking skills",2020-09-27,0.0
GRADUATE SALES EXECUTIVE - SAAS BUSINESS INTELLIGENCE,BMS PERFORMANCE LLP,NONE,https://www.indeed.co.uk/pagead/clk?mo=r&ad=-6NYlbfkN0CdFJWBSzOfA2i3S2vzhjnzWrVYwFHIQ7yHB5cyvsODgxd-75gP1_acTnKfpBhoY5ieGDFsI7ebAnHr1XVOfnAD1_0RjFWyrEKkO7m_c1BmqbueboR-XQ_GdYf8Xycc3KzNsSdN26UnYgBlo9Y3i6qe3dnDhg__FxKQxju-XQsh1XNYjiG_9mHoIrubkzyzGaYn2OWDL84kYSxY16QSIQSz6JycAr_OzAop1_VcejIfXcaZ8qP9IzZTmWfbL8hUm_41mCuTtf7x0r4f_Fmh7eHpQI7yvKwSfIUDY3cn-c4qt3oUQKiZXrMe2Dv8mNEwyXOTIuL2KlgU_zgQu6mrifJ2JiWcYD-IOmhq6nu_KAu4U_CZ9PTcVw-ngecAaCoVeyXgBjbz1gy1bS2PWSc7fy4Z-3JfovOJoDyh2ll6R5_H0UveQGG_ly3uWKuM3dzA0NGjxMRf3YryCkuv7RT8ibNmXzN9vSRFWRONU4l6Nxkhpz3XPEXUjVP_ki1VwlR9sTz3IkS5oRM9IzbWdiIrXbyH1I65_NdzB8gUWSM_Pql3CkikU1fNF00odahSVpEIUA7SiPFtnjHfsx_hpcz1oKgdsnJdSA_WWZpbxTDP9U_yMDhYTpmckVBFsXPoe00kLmagpgjozw8t4okllOsEuH3ihdqE2OB2YaIY5Yx6fgswlQ==&p=1&fvj=0&vjs=3,3.8,"£30,000 a year","looking to kick start a graduate sales career with daily exposure to c-level executives
sell innovative technology solutions
full graduate sales training
learn more about the lucrative saas industry
the role: generating new leads by reaching out to ftse 100 companies and building rapport with c-level executives. looking for a graudte who is driven and a self starter wanting to develop their skills and build the base of a exciting career in sales.
the company: growing 50% year on year, the company is actively looking to expand their sales team. regular company socials and quiz nights demonstrates the modern day culture this company exudes. offering an extremely competitive graduate salary with full sales training an other company benefits.
responsibilities as a graduate sales executive will include:
lead generation
outbound business development
talking to c-level executives from ftse 100 companies
for this graduate sales position, we are looking for individuals who meet the following criteria:
recent graduate (2019/2020)
outgoing
hard working
professional and articulate
target focused
the package for this graduate sales role:
£30,000 basic
ote £45,000 year one
25 days holiday
mobile and laptop
healthcare plan",2020-09-29,0.0
GRADUATE FINANCIAL ANALYST,SAFETYKLEEN,NONE,https://www.indeed.co.uk/pagead/clk?mo=r&ad=-6NYlbfkN0A7RSs0xouNTkJzrpF-43LpmrJPiTKtPPZ0RuB33VQJuHYwAi8sd73ru4p8n_Vdb1DrPK5GViD85Vsq33d5F4TFHUHK1VeFoA-HG7mVcuAjeixiI0ms8aVwqgZxo5ORUvciYumkkJNKFimzPKUO14Zl8zpxfZW0UBHSLcIW8iUoBsIN1TXFWiyD2p65x5A-BBoF3G1Er9UTWWqZydTquOlBDgaW5yDQW0uFMcjWsGKsRGgGfsyTR1DRbOyg9yiCVIMKGpKdYV6nMEEyftcpF6KdPN5Y94ew9yEakZo9ktcOHU18sPLGJgarLTXl6jAIfyjldxN9O3Pab5RJlCXiuXclxeiDok12-EY2wfjFl1LegIzR3EVqzKjy0IBjLc3A1RpLi5x_KsT07o2aB9dGmIj-g2HPjgzu94_THry_BT6ADqQ2Z4uvSPNb3pl6qfiKcVmvj_kXIg-NA__kmNv-RHLovC8yAphXHVEyMs-3dS4HiM6nrdRsmnRKVE-xFPmVtGkies9LjqwibBityIMghgvApL4CeyC00lJy_FHBJzzcz8aNMO3O7oEj1sqvEsafAYzs2eykgXWEdZJSP9a7zcY1v1-hmYxWxh4=&p=2&fvj=0&vjs=3,3.2,None,"who are safetykleen?

we are the leading provider of chemical cleaning and environmental solutions all over the uk and europe with the international head office in brentford, london. we offer a unique service that combines parts cleaning equipment, environmental consultancy, and industrial waste collection to a diverse customer base, including transport, metalworking, manufacturing, and construction. we have over 1,700 employees across 14 countries. we are a socially responsible company that provides environmentally sound services and employs waste reduction practices that decrease environmental impact.
we are looking for a talented individual that has the drive, enthusiasm, and commitment to deliver a professional service to support our business growth. if you are this individual, we will offer you a competitive remuneration package and career development, in addition to providing you with the latest technology, training and support to ensure that you are successful within your career at safetykleen.
the role:
the graduate finance analyst role based at our group head office in brentford. reporting to the head of group financial planning & analysis, the analyst will assist in the delivery of fp&a team reporting outputs (i.e. sales & financial forecasting and operational performance analysis).
the role provides an excellent opportunity to work in a fast-paced pe-backed company environment with significant exposure to different roles across the company. in the role you will be part of a forward-thinking team and gain a wealth of experience from the people you work. the role is open to candidates looking to either develop their career within a commercial or financial role with study support for acca/cima qualification available for the latter.
responsibilities of graduate financial analyst:
weekly kpi reporting for the board, liaising with country finance and ops teams to ensure accurate and timely delivery of data packs
consolidation of the monthly group financial & service performance forecasts for monthly review calls with group and country leadership teams
supporting the monthly sales forecasting process; preparation / consolidation of standardised templates used for review in the monthly sales forecast calls with country directors
preparation of month-end cost variance reports by country for group procurement team to support latest cost control initiatives
support the annual group budget process with reconciliation of budgeted country financial statements to agreed targets, coordinating necessary adjustments to the hyperion reporting system. in addition to preparation of ad hoc analytics for budget review sessions
ad hoc projects and analysis as required by management
role of graduate financial analyst:
a degree at 2:1 or above – there is no specific requirement as to the subject, but the individual must be highly numerate with strong microsoft excel skills, and be able to demonstrate an interest in business
a quick learner, keen to understand how business operates and is managed, and apply this knowledge to improving team reporting outputs to better support our stakeholders
excellent written and spoken communication skills
great attention to detail and strong work ethic
good organisational skills, comfortable working in a fast-paced and changing environment
ideally previous experience gained in a financial or commercial role, e.g. via a summer placement
benefits for graduate financial analyst:
enhanced industry standard salary
private healthcare scheme
life assurance coverage from day 1
stakeholder’s pension scheme
30 days holiday entitlement with additional bank holidays
corporate discount scheme focussed on your wellbeing, including virgin active gym membership
we provide support and access to a range of internal and external courses to help develop and progress your career with us
finally, we recognise those important celebrations in your life, such as birthdays, work anniversaries and becoming a parent",2020-09-29,0.0
GRADUATE MACHINE LEARNING ENGINEER (TRUST AND SAFETY) - 2021...,TIKTOK,LONDON,https://www.indeed.co.uk/rc/clk?jk=f0a82b81b5530d8b&fccid=caed318a9335aac0&vjs=3,4.1,None,"responsibilities
tiktok is the leading destination for short-form mobile video. our mission is to inspire creativity and bring joy. tiktok has global offices including los angeles, new york, london, paris, berlin, dubai, mumbai, singapore, jakarta, seoul and tokyo. we are now looking for talented individuals to join us in 2021 - people who want to inspire creativity and co-create the future with tiktok. regardless of the function you choose to specialize in, our graduate roles will enable you to participate in meaningful and innovative projects. your potential for growth at tiktok is limitless. join us to enhance your skill set and develop your network in the tech industry. while fulfilling our mission, tiktok identifies trust and safety as a top priority and our team is dedicated to enhancing it. our trust and safety engineering team is responsible for developing state-of-the-art machine learning models and algorithms to protect our platform and users from the content and behaviors that violate community guidelines and related local regulations. with the continuous efforts from our trust and safety team, tiktok is able to provide the best user experience and bring joy to everyone in the world. this role will support with: 1. building industry-leading trust and safety systems for tiktok; 2. developing highly-scalable classifiers, tools, models and algorithms leveraging cutting-edge machine learning, computer vision and data mining technologies; 3. understanding product objectives and improve trust and safety strategy and model iterations; 4. working with cross-functional teams to protect tiktok globally.
qualifications
1. bachelor or above degree in computer science or a related technical discipline; 2. some experience in at least one of the following areas: machine learning, pattern recognition, nlp, data mining, or computer vision; 3. good understanding of data structures and algorithms; 4. great communication and teamwork skills; 5. passionate about techniques and solving challenging problems.",2020-09-29,0.0
