Title,Company,Location,Link,Review,Salary,Description,Date Added,Applied
DATA SCIENCES & AI GRADUATE PROGRAMME - UK,ASTRAZENECA,NONE,https://www.indeed.co.uk/pagead/clk?mo=r&ad=-6NYlbfkN0Ce2zUkCmPBFJcjTU5zF1if0cc7elp84qf5zXxn-5zHeCbq6wx1m1AmjTVBDcF3y4Z6uQ8_bvePsI-DnoiFOkYt_SIHKQnA1AgqU0XOvvUxTH--qZellbXrhtUPKKwYidAB7a1U878YJFdh0dyXFs_ps9yHJyhj0POwPlDEg9A3QU7DAZZ5w0aBAwqnzm6_xWzaLCzzaoOBNRi2mg9KaPs6IARdSqhnZMWZTsNAZmH41EH5JeWilNrYYJFi5CyxwH5Iexd2-jcABfTKLR8gM5CFrRfHyLxfuFdFdkzHADB08QaDQ0G2GWiW-aL3MdJXIhYK0JyZd2-Hg52LdC_TXwYkSaea3lbiyuYqKsO3zFVkYxq7Dq4Ikl8Y3Ufgp50zQWrqIAQDJFDQz6jnAaqVZ7ReEwjkd-vH_9ISdy5bDOE60CHCdB0PfKDpOqznWeWEX0i_oMafybIIHkA8gDPWfpkLDhPj6aW9BTwxgphTc-gDTDwHpV4DVJeZrW860gEnaCIp3ObvLI6DInnX0k_El3UBgIYTCsM5KeBNHMlp-Eh5VNWhFImjmw6hi1GTJ7NCyTuVBn2K0CzZ4wOXgyzM4-nmebiU87K1hC5PCd9BHWWvouHZxhXlxQsc&p=0&fvj=0&vjs=3,4.1,None,"data science & artificial intelligence (ai) graduate programme - uk
location: cambridge, (uk)
salary: competitive, with excellent benefits package
if you have a bachelor’s or master’s degree and a desire to explore and develop your skills in data science and artificial intelligence within a global biopharmaceutical organisation, our data science & ai graduate programme could be the perfect start to your career. you’ll gain invaluable insight, exposure and opportunities across our diverse, research and development organisation. we’ll accelerate your learning and help you achieve your potential.
what does the programme involve?
starting in september 2021, the programme lasts two years, consisting of three individual eight month placements. each placement will provide you with fantastic insights and experience in our use of machine learning, ai and data science to advance drug discovery and development.
the programme’s variety and flexibility provides you with opportunities to apply machine learning, ai, and data science techniques to help push our scientists push the boundaries of science to develop life changing medicines for patients worldwide. you could be contributing to detecting safety risks, designing novel molecules, optimising clinical trial design and processes, or developing new models for use in high profile drug discovery and development projects. as well as helping you broaden your industry and technical knowledge, we’ll help you develop ‘soft’ skills required to fulfil your career potential.
you will gain an invaluable blend of on-the-job experience and coaching. you’ll enjoy guidance and advice from a huge support network, including a mentor and dedicated programme manager. we’ll also encourage you to identify and build collaborative relationships with specialists and leaders across our organisation, and our external networks including leading academic and biotech research institutions. together, we’ll help accelerate your development and knowledge!
essential requirements
a bachelor’s or master’s degree in a quantitative science focussed subject including maths, physics, statistics, computer science and software engineering awarded in 2020, or due to be awarded in 2021.
experience of applying data science, artificial intelligence, machine learning, statistics, computational biology, computational chemistry, bioinformatics or cheminformatics techniques.
knowledge of the design and application of machine learning or statistical models.
experience in using multiple data-centric programming languages to enable big data analysis (e.g. python).
enthusiastic and passionate advocate for the potential of data science and ai to make an impact.
proactive problem solving and critical thinking skills.
planning, organisational and time management skills.
collaborative, with a partnership approach to achieving success.
together, we push the boundaries of science to deliver life-changing medicines to patients around the world!
applications open: 21st september 2020
applications close: 21st january 2021",2020-09-22,
DATA AND ANALYTICS - GRADUATE PROGRAMME,NATWEST GROUP,EDINBURGH,https://www.indeed.co.uk/rc/clk?jk=fb39f06ee14b969e&fccid=4a3a2b1eb3ec0691&vjs=3,4.3,"£31,850 a year","about you
to be eligible for our data and analytics programme, you’ll need to have, or be on course to achieving a 2:1 in your degree
we’re looking for curious, inquisitive people who show a real passion for data and technology, and the drive to explore how it can be used to make a positive difference for our customers
you’ll bring strong problem solving skills, along with an analytical approach and an appreciation of analysis techniques
about the programme
as a graduate trainee in data and analytics we’ll equip you with the knowledge, skills and experiences you’ll need to make a significant impact and become a leading data expert. you’ll learn about the ways we’re using data to drive changes and improvements to customer experiences, and challenge you to consider ethical issues and focus on keeping our customers’ data safe.
we’ll reward you with a starting salary of £31,850 a year. and on top of your salary, you’ll also have access to our flexible benefits package.
over the course of this two year programme you’ll:
learn the core technical skills needed to succeed as an analyst
interrogate, interpret and visualise large volumes of data
learn how to articulate complex situations and technical work to a non-technical audience
drive the use of data across the bank to ensure better customer engagement
build your confidence, and developing your influencing and stakeholder management skills
see first-hand how our data academy can help you develop a strong foundation in critical data skills, and provide the opportunity to master specialisms like data science and data engineering
about the business area
our data is one of our greatest assets, and how we harness it to understand the world, our business and our customers’ needs is crucial. in data & analytics, we promote the intelligent use of data and make sure it’s used in the right way.
good data engineering helps us get to grips with the data we have. and data science allows us to apply statistics, computer science and problem solving skills together with strong research methods to test, learn and optimise machine learning powered decisions to help customers.
if you need any adjustments to support your application, such as information in alternative formats or special requirements to access our buildings, or if you’re eligible under the disability confident scheme please contact us and we’ll do everything we can to help.",2020-09-22,
GRADUATE DATA SCIENCE ENGINEER,ARM,MANCHESTER,https://www.indeed.co.uk/rc/clk?jk=88ace5866aac5768&fccid=0110be8f148b4964&vjs=3,4.2,None,"we are an equal opportunity employer and do not discriminate against any employee or applicant for employment because of race, color, sex, age, national origin, religion, sexual orientation, gender identity, status as a veteran, and basis of disability or any other federal, state or local protected class.
job description




are you looking for an opportunity to help develop and release the latest gpu technology? are you interested in applying your proven experience in the challenging environment of gpu driver development?
arm is seeking highly skilled and motivated graduate data science engineer to join our agile software development group. you will be part of a new team based in manchester (uk) with the opportunity to drive our module test, and performance analysis environment.
you will be working with multi-disciplined engineering teams across arm’s worldwide engineering centres. you will contribute to the analysis of the detailed module test and automated test infrastructure to ensure we achieve the right level of test coverage as effectively as possible for the next generation mali™ gpus.
we have an excellent track record of building up expertise in people, so this is a great opportunity to learn something new and interesting in a friendly and collaborative environment. join a multinational, dynamic and highly motivated software development group where you will enjoy the support of your colleagues while being challenged by interesting technical problems. do you like producing high-quality solutions in a challenging environment? - then we would love to hear from you.

about the gpu team
in the gpu team, you will be working alongside the best engineers in the world, making market-leading products for the world’s most successful companies.
with applications in mobile, machine learning, internet of things, automotive, security, and embedded devices, your ideas will make a difference and you will have the opportunity to lead, challenge the status quo and ultimately change the world of media processing.
our mali™ graphics processor is the world’s #1 shipping graphics processor.
we are a global team, working across numerous sites and cultures and we are entering a new growth phase to provide new technologies and products for new and existing markets and are looking for talented people to join the team.
please take a look at the following video to see what it's like to work in arm: https://youtu.be/f4tnbnbgyey
job requirements




education & qualifications
bachelors, masters or phd in data science or similar subject, with a good academic record.
desirable skills & experience
experience of scripting with tools such as python, sql and bash.
experience with data analytics tools such as pandas, numpy and elasticsearch.
experience with dashboard and charting tools such as grafana, tableau and matplot
demonstrable data analysis project experience, either academic or professional
a practical, organized and pragmatic approach to work.
willingness and ability to contribute to process improvement initiatives.
you will exhibit many of the following qualities:
self-reliant and who seeks out information and learning when required
ability to solve problems creatively - e.g. challenge the status quo and suggest novel approaches
evaluate proposals critically - e.g. contributing to design discussions and code reviews.
address all life-cycle phases of large tasks, from specification through test and user documentation, with minimal supervision.
take on a technical leadership role for some aspects of project work, investigations, and feasibility studies.
provide support and guidance to our internal users and colleagues.
understand development and project processes in depth.
be willing to travel occasionally to arm location in the uk and worldwide.
at arm, we are guided by our core beliefs that reflect our rare culture and guide our decisions, defining how we work together to defy ordinary and shape extraordinary:
we not i
take daily responsibility to make the global arm community thrive.
no individual owns the right answer. brilliance is collective.
information is crucial, share it.
realise that we win when we collaborate — and that everyone misses out when we don’t.
passion for progress
our differences are our strength. widen and mix up your network of connections.
difficult things can take unexpected directions. stick with it.
make feedback positive and expansive, not negative and narrow.
the essence of progress is that it can’t stop. grow with it and own your own progress.
be your brilliant self
be quirky not egocentric.
recognise the power in saying ‘i don’t know’.
make trust our default position.
hold strong opinions lightly.
benefits
your particular benefits package will depend on position and type of employment and may be subject to change. your package will be confirmed on offer of employment. arm’s benefits program provides permanent employees with the opportunity to stay innovative and healthy, ensure the wellness of their families, and create a positive working environment.
annual bonus plan
discretionary cash award
group personal pension plan with enhanced company contribution
medical, travel, health & life insurances
holiday, 25 days annual leave with option to buy an additional 5 days per year
sabbatical, 20 paid days every four-year of service
volunteering, one (1) paid working day each year (teamarm)
varies by location: cycle to work, free car parking, gym on site, team and social events
about arm
arm® technology is at the heart of a computing and connectivity revolution that is transforming the way people live and businesses operate. from the unmissable to the invisible; our advanced, energy-efficient processor designs are enabling the intelligence in 86 billion silicon chips and securely powering products from the sensor to the smartphone to the supercomputer. with more than 1,000 technology partners including the world’s most famous business and consumer brands, we are driving arm innovation into all areas compute is happening inside the chip, the network and the cloud.
with offices around the world, arm is a diverse community of dedicated, innovative and highly talented professionals. by enabling an inclusive, meritocratic and open workplace where all our people can grow and succeed, we encourage our people to share their unique contributions to arm's success in the global marketplace.
about the office
our office in manchester, england hosts diverse teams from throughout arm including debuggers, hpc tools, technical communications, devops infrastructure provision and open-source software development. the office is located in the heart of manchester city centre allowing easy access to shops, restaurants and a bustling nightlife. known for its world-renowned sporting connections, manchester is seen as the united kingdom's ""second city"", as it is the most visited city in england by overseas visitors aside from the capital.
manchester, uk
arm ltd.
7th floor
westminster house
11 portland st
manchester
cheshire
m1 3hu",2020-09-22,
GRADUATE DATA ENGINEER,UK GOVERNMENT - DEPARTMENT FOR EDUCATION,SHEFFIELD S1,https://www.indeed.co.uk/rc/clk?jk=fcb36ab24ac76fa4&fccid=cbda7e147ac9461f&vjs=3,3.7,"£29,363 a year","our data engineers develop and construct data products and services and integrate them into systems and business processes. you will develop your technical skills to design and install new data solutions that support the creation of data products. you will work with internal and external partners to understand and meet business requirements.

we work with sql server systems in addressing performance and maintenance of data processing to underpin routine reporting. you will assist in the designing, building, testing and maintaining data management systems and models, making sure they are compliant to data governance and meets business requirements. you will work to deliver automated services that are reliable and secure, working with data architects and data scientists.
responsibilities
main activities will include:

develop fit for purpose, resilient, scalable, and future-proof data services to meet user needs.

collaborate and implement data management systems that link data from multiple systems and platforms.

implement appropriate technologies to deliver resilient, scalable, and future-proof data solutions.

design, write and iterate code from prototype to production-ready, managing relationships with subject matter experts to make sure content is accurate.

collaborate with others to review and challenge specifications and where appropriate promoting the best solution design.

use agreed standards and tools to design, code, test, correct and document moderate to complex programs and scripts from agreed specifications and subsequent iterations.

implement industry recognised data modelling techniques including dimensional modelling and standards and where necessary reverse engineer data models from a live system.

effectively translate and accurately communicate across technical and non-technical stakeholders as well as facilitating discussions within a multidisciplinary team.

supporting the lifecycle of data (sourcing, storage, processing, and transmission)

helping define, implement, and operate administration of data and systems (processes such as access controls)

document and maintain glossaries/policies for data and definitions eg asset registers, retention schedules, dictionary and loading schedules

support in establishing and monitoring data quality metrics, identifying and resolving issues.

translating and simplifying requirements

unit testing of own work and testing others work, including working in test-driven development environment

it is essential that you can evidence skills against the following criteria:

a mathematics-based or computer science-based degree

excellent numerical, it and problem-solving skills

build accessible data for analysis

experience of using programming languages / analytical software such as sql, python, r and power bi

writing etl scripts and code to make sure the etl process performs optimally

good communication and collaboration skills with a diverse team in both technical and non technical elements

should there be a large number of applicants and the panel have a tie-breaker situation, they will consider your evidence of skills against three of the following desirable criteria:

sql 2012 or later server tools such as sql server integration services (ssis) and/or sql server analysis services (ssas). used concepts such as, metadata, indexing, modelling, and master data management.

modelling data and to develop business intelligence reports that can be re-used

ideally work experience or certification in data management / data engineering or similar industry professional certification.

awareness of cloud data tools and platforms

excellent customer facing and people skills, being able to communicate between the technical and the non-technical

understanding of agile concepts

performed testing or quality assurance of own work and others work

understand data governance, data security and data quality over the data lifecycle

understanding the development lifecycle and use of source control tools

as part of the assessment we will also be looking for you to have an understanding of the essential skills from the digital, data and technology profession relevant for this role:

communication skills (data)
data analysis and synthesis.
data development process
data integration design
data modelling
metadata management
problem resolution (data)
programming and build (data engineering)
technical understanding (data engineering)
testing

more details can be found here: https://www.gov.uk/guidance/data-engineer#data-engineer

qualifications
a mathematics-based or computer science-based degree
technical skills
we'll assess you against these technical skills during the selection process:
developing new products
benefits
applicants currently holding a permanent post in the civil service should note that, if successful, their salary on appointment would be determined by the department’s transfer / promotion policies.

as a member of the dfe, you will be entitled to join the highly competitive civil service pension scheme, which many experts agree is one of the most generous in the uk.

you will have 25 days leave, increasing by 1 day every year to a maximum of 30 days after five years’ service. in addition, all staff receive the queen’s birthday privilege holiday and 8 days’ bank and public holidays.

we offer flexible working arrangements, such as job sharing, term-time working, flexi-time and compressed hours.
as an organisation, which exists to support education and lifelong learning, we offer our staff excellent professional development opportunities.",2020-09-22,
2021 GRADUATE DATA SCIENTIST,SAGENTIA,EPSOM,https://www.indeed.co.uk/company/Sagentia/jobs/Graduate-Data-Scientist-85d94d75bafddc34?fccid=60b8b7984a3bba9e&vjs=3,4.7,None,"are you an enthusiastic and curious individual who enjoys using data to find patterns and help solve the problems faced by businesses in innovative and imaginative ways?
would you relish the opportunity to apply these skills across diverse industries?
the opportunity
we are looking for exceptional, energetic, hard-working and hands-on enthusiastic graduates to join our group of world class employees in autumn 2021. if successful you will be part of this team and have the unique opportunity to work with clients from start-ups through to global market leaders. you will have a passion for technology and will use a combination of innovation, flexibility and technical excellence to meet and exceed our customers’ often demanding requirements and tight development timescales.
you will work across the product development lifecycle, from new concept generation and technology validation, through prototyping and full product development, to transfer to manufacture and sustainability.
we have
a multitude of exciting projects in the medical, industrial and consumer sectors
projects ranging from quick build proof-of-principle prototypes through to full product developments
the opportunity to work with clients to define their needs and to develop innovative and exciting solutions
you will have:
degree 2.1 or above, (or even a phd) in computer science, engineering, mathematical or science-based from a top university
excellent analytical and problem-solving skills
enthusiasm to work within multidisciplinary teams and multi-task across projects.
you might also have (but not essential):
keras and tensorflow familiarity
python development experience
matlab/simulink familiarity
pc software development experience
a day in the life
you'll extract, analyse and interpret large amounts of data from a range of sources, using algorithmic, data mining, artificial intelligence, machine learning and statistical tools, in order to share your methodologies and insights with the wider team.
your work will predominately be based at our sagentia offices in harston, cambridge or epsom, surrey and there may also be opportunities to travel to client sites in europe or usa. you will enjoy a fast-paced environment in which we solve a variety of challenges from different industries where you will be driven to stretch yourself and demonstrate determination and focus.
at any one time we have dozens of active projects in the medical, industrial and consumer sectors. as a graduate, you will have the opportunity to utilise and improve your data science skills on one or more projects simultaneously across sectors. projects range in length anywhere from a couple of months to a couple of years. projects will typically require multidisciplinary skills requiring teamwork, independent research, electronics design, mechanical design, software design and of course a data science team that you will be part of.
career development
you will work on client projects from your first day; we think this provides you with the opportunity to learn from a fantastic team of colleagues and put your great technical skills to use immediately! we work with you from the start of your time with us to ensure we understand how you want to develop your career in the future. we have a great variety of projects taking place at all times and identify, offer and provide bespoke training to support you in developing your existing skills and fill in any gaps. when you join you will be paired with a mentor whose job is to help you settle in, inspire you and instil the sagentia way.
every one of our employees has the opportunity to progress and develop within our business – there is no career ceiling; with commitment, hard work and determination there is no limit to what you can achieve! success looks different to everyone and sagentia provides great career advancement whether you want to apply your technical skills to brilliant projects, find solutions to problems no one else can solve, deepen and broaden your technical knowledge, manage complex projects, lead teams or business development!
benefits
you will be offered a competitive salary and benefits package.
job types: full-time, permanent
schedule:
monday to friday",2020-09-22,
