Title,Company,Location,Link,Review,Salary,Description,Date Added,Applied
GRADUATE STATISTICAL ANALYST,FIRST CENTRAL,HAYWARDS HEATH,https://www.indeed.co.uk/rc/clk?jk=5fa4a9a702451663&fccid=3076bed1565e8ed2&vjs=3,4.4,"£24,000 a year","we have a fantastic opportunity for a graduate statistical analyst to join our talented pricing innovation team in haywards heath, west sussex.

the successful candidate will provide detailed investigation and insight by producing analysis and reports that maximise customer satisfaction and profitability of the company.

you’ll be actively involved in key projects to drive the company into the new era of data insight and communicate your results with a broad range of audiences.

this role will offer a great opportunity to work alongside experts in the field and learn a range of statistical methods, including generalised linear modelling, machine learning and exploration into the newest cutting-edge techniques.

we will offer training in the standard tools used in the underwriting department including sas, emblem, radar, r or python and h2o. you’ll also learn analysis techniques including glm, decision trees, cbm, random forests and neural networks that are used widely in the industry, whilst we also provide study support for actuarial exams.

throughout this role you’ll learn more about the motor insurance market and the relevant standards and regulations, while analysing and building predictive burn cost models using linear and non-linear statistical techniques, all helping to solve key company questions.

job responsibilities
analyse and build predictive burn cost models using linear and non-linear statistical techniques
solve key company questions; provide analysis, insight and competitive advantage to the company by producing analysis and reports
maintenance and writing of analysis programmes written in sas, radar and other software packages
build predictive models using sas, emblem and other software packages
ad hoc project work and provide analysis to relevant teams
skills, knowledge & experience
minimum 2:1 in a numerical undergraduate discipline
strong statistical techniques and mathematical skills
strong knowledge of ms office tools (in particular excel)
able to transfer skills and knowledge to others
strong problem-solving skills with the ability to adopt a logical approach to solving problems
excellent data and statistical analysis skills
logical thinker with solid reasoning ability
commercially focused
emphasis on attention to detail and accuracy
self-motivated and enthusiastic
an organised and proactive approach

what can we do for you?

we believe we can offer you a great working environment as we’re so passionate about our people. here are just some of the benefits and perks that we offer…
fantastic training and development opportunities
employee benefit packages to suit your lifestyle
flexible working
a day off for your birthday
the opportunity to take a paid day off each year to do charity work
a health cash plan
help with travel expenses
the opportunity to buy additional holiday
company pension scheme
group life assurance
enhanced maternity and paternity pay
professional subscription fees paid
employee wellbeing is high on the agenda here too. we provide a weekly free fruit delivery, discounted membership at a local health club and access to an employee assistance programme, which promotes physical and emotional wellbeing at work and at home. in addition, we provide wellbeing events throughout the year to support physical and mental health.

for further information on what we can offer and to learn more about this role, feel free to contact our dedicated recruitment team.

if you’d like to work for an award-winning employer in a fast-paced environment, apply now!

we’ve received some great feedback from employees on glassdoor. don’t believe us? check out our reviews for yourself!",2020-09-22,
2021 GRADUATE ECONOMIC ANALYST - LONDON,FRONTIER ECONOMICS LIMITED,LONDON,https://www.indeed.co.uk/rc/clk?jk=c9e140bf75384324&fccid=77a87316f637bc50&vjs=3,5.0,None,"frontier is an economics consultancy that tackles the big questions facing governments, businesses and society. we support our clients on some of the most interesting, topical and high-profile issues across these areas. we help our clients to analyse and understand their markets and to formulate strategies based on sound economics. the methods and models we use are often complex, but our advice is always succinct, clear and honest. we use our analysis to provide insight into complex situations, giving clients jargon-free opinions and results that can withstand even the closest scrutiny.

we advise across sectors and countries and we are one of the largest economic consultancies in europe with more than 200 economists based in our offices in brussels, berlin, cologne, dublin, london, paris and madrid. owned entirely by our staff, our business attracts the best people and the most interesting work. we go beyond the numbers to find out what’s really going on. our clients enjoy objective advice, clearly expressed. with our help, they make better decisions and get better results.

about analyst programme
what is great about being a new analyst at frontier, is that your programme lasts two years allowing you plenty of opportunities to find out more about the working world of economics. you will have the opportunity to rotate across some of our practices whilst working alongside our highly experienced economists.

you will also have the opportunity to work in one of our other european offices.you will attend a comprehensive induction week, held in london and attend weekly training sessions for the first six months. you will then continue to have regular seminars, internal training and mentoring.

throughout the programme you’ll be supported by two experienced mentors and your graduate ‘buddy’ who will help support and guide you through your programme!

analyst roles will typically commence in september and october 2021

what will you be doing in your new role?

as part of a team and supported by your mentors and buddies you will:

start working for our clients very early on with the support of more experienced consultants
deliver robust and accurate technical or theoretical analysis
share thoughts and ideas to solve client problems, involving internal and external meetings
contribute to the writing of reports, slide packs or notes, written in a logical and well-structured manner using language appropriate for the intended audience
apply economic frameworks, ranging from simple data analysis to complex econometric modelling
present your findings to colleagues and clients
continue to develop and grow your excel, stata and modelling skills
collaborate with your project team/s, whilst also being able to work alone on a piece of analysis seeking support when required
manage your own work and time to ensure you meet the agreed project deadlines, seeking advice from more experienced consultants as required.
have the opportunity to work with frontier economists across our emea offices and,
play a part in the running of the firm working on projects that enhance our culture, working life and client experience.

about you

you will be a predicted or have obtained 2:1 bachelor’s degree in economics (or equivalent) and a masters in economics. if you are an undergraduate without a masters, please apply for the undergraduate analyst role.
strong interest and understanding of micro-economics
ability to thrive in a collaborative environment
strong excel skills
exceptional communications skills (leadership skills, feedback skills, communicating under pressure.
ability to meet deadlines
a fluency in the native language of the country you are applying to (a second language is also desirable, but not essential)

what you need to do next
if you would like to apply submit your application now!

deadline: 1st december 2020
(we would strongly encourage applicants to apply early as positions will close once vacancies are filled)

frontier economics is an equal opportunity employer and makes employment decisions without regard to race, colour, religion, gender, sexual orientation, gender identity, national origin, disability status, age, or any other status protected by law.",2020-09-22,
JUNIOR BUSINESS ANALYST,NOIR CONSULTING,NONE,https://www.indeed.co.uk/pagead/clk?mo=r&ad=-6NYlbfkN0Aj4-Lc4C6Hb0ykU3jOktLDIAAw4anZygn__rtZFvHgNZCGNaCmpag7pjXHaxBLOHZnNI-S9rEhIvPmPtSKcL3ae7gyl2roybFNdEj8_zyMvZXlRDAfUQ2RXK8vsEuTy0vqGFhkLdHdMCP77W_yi0DTVTqHLzaWPlHObBmOlIGNsbcVQ-MwtL3GBeCp5LPda6etMoMgvxGQkLfCpgDDzghFNkO1ygwrJrCGiMYdF6Z1amL7w1ir6Vh8HfnuiDF5CsTzHEzFzX0aFXhbDLwIgvVjStLPvyi-f_EYEZkX7KOzo3WLxd9pIcMj6l6goRxcMccm2LBgJs_0NQy7pzksUf1oNDROR8bqmdk8YjygjRIt8-g6q9Jmi9F_RVqh_Az6GppBbbo45eU65xbDpynJVZIl76RuEcnFGxijWnuifEUtI-eVJyge1fhuufATAFPe6I4-RlY8BAqjUt28ZLICDgyc&p=13&fvj=0&vjs=3,5.0,"£30,000 - £40,000 a year","(tech stack: junior business analyst, investment, wealth management, junior business analyst, urgent)
we have several fantastic new roles for junior business analyst to join an ambitious fintech start-up. this is your chance to work with the sharpest minds in investment and wealth management. our client’s latest product release has changed the way people view investment and wealth management and allowed them to provide their clients with an individualised, scalable asset management framework that is unrivalled in today’s market place.
our client is looking for passionate junior business analyst who have the ability to understand the principles of investment and wealth management. you should be experienced in requirements gathering, building requirements, managing clients’ expectations and assist project managers with implementation tasks. these positions would be suitable for a graduate with a strong academic background with 1 or 2 years’ experience as a business analyst. ideally you will have some knowledge of sql server databases.
this is your opportunity to be part of a new, technically challenging project and to be involved in the creation of a new application from scratch. fintech is booming and our client are fast becoming a leader of this market!
all junior business analyst positions come with the following benefits:
shares in the company.
pension scheme (8%).
bupa private healthcare.
an annual training allowance of £4.5k.
27 days holiday (excluding bank holidays) plus your birthday off.
flexible working hours.
work from home 1 day a week.
pizza and beer fridays.
access to free yoga classes which take place over lunch or after work in their fitness studio.
location: london / remote
salary: £30 – £40k + bonus + car + benefits
to apply for this position please send your cv to sham ahmed at noir.
(junior business analyst, investment, wealth management, junior business analyst)",2020-09-22,
PRICING ANALYST GRADUATE SCHEME - STARTING JANUARY 2021,NFU MUTUAL,STRATFORD-UPON-AVON,https://www.indeed.co.uk/rc/clk?jk=9477941068e0f290&fccid=439781c7417a1819&vjs=3,3.7,None,"about us
excellent package & prospects • based stratford-upon-avon

having won the gallup great workplace award for a fourth consecutive year in 2019, we are justifiably proud to be one of only 40 companies across the globe to receive this prestigious accolade. as a billion-pound business and award-winning provider of general insurance and financial services, built on over 100 years of heritage, we really can lay claim to being a great place to work and a genuine destination of choice for ambitious graduates.
the role
head office based and undertaking a tailored 3 year programme, this is a rare opportunity to work and learn in a relatively new, yet rapidly expanding pricing function, that has benefited from substantial investment in technology and people to create a cutting-edge hub of in-house expertise. assigned your own personal mentor and joining a 50 strong team, you will receive a thorough grounding across all aspects of insurance pricing – spanning our commercial, personal and motor business lines – with a focus on data analysis and manipulation to ensure effective pricing outcomes. enjoying plenty of scope and variety, as well as early and increasing responsibility, our aim is to give you a real breadth and depth of exposure, ensuring you are fully equipped to make your mark and help shape new ways of working in this exciting sphere of operations.
person specification
commercially aware and with a genuine desire to develop and progress, you will relish the chance to work in a collaborative environment, where everyone plays a part. having graduated with a minimum 2:1 degree in a subject with high numerical content, such as a maths, science, analytics, engineering , economics or a related discipline, we are looking for an excellent communicator and problem solver, with impeccable attention to detail and an analytical mindset. however, of equal importance, will be a willingness to consistently challenge yourself to be the best you can be and contribute to an evolving service provision focused on delivering long term value for our customers.
qualifications/other
a minimum 2:1 degree in a subject with a high numerical content


there is more to joining nfu mutual than just the salary and benefits – good as they are! instead we would like you to focus on the bigger picture, including the personal development opportunities on offer and the professional qualifications you will gain along the way (such as the cii certificate or similar). rest assured, today’s graduates will form our next generation of leaders and as such are highly visible within the business, enjoying widespread exposure and plenty of interaction with senior management, whilst being given all the tools needed to succeed – you get the picture?",2020-09-22,
JUNIOR BUSINESS ANALYST (ADULT SOCIAL CARE TECH AND DATA ),GRADUATES INTO HEALTH,LEEDS,https://www.indeed.co.uk/company/Graduates-into-Health/jobs/Junior-Business-Analyst-5182dfa5106dd747?fccid=88498c4a195c45ef&vjs=3,None,"£32,933 a year","graduate scheme: nhs graduate digital, data and technology scheme
role: junior business analyst (adult social care)
organisation: nhsx
salary: starting £32,933
location: leeds or london (please select preferred location)
contract length: two-year fixed term
the organisation
nhsx is leading the largest digital health and social care transformation programme in the world. with investment of more than £1 billion pounds a year nationally and a significant additional spend locally, nhsx has been created to give staff and citizens the technology they need.
nhsx brings together the department of health and social care, nhs england and nhs improvement who will deliver the health secretary’s tech vision, building on the nhs long term plan. we will speed up the digital transformation of the nhs and social care. we have set ourselves five missions, which are focused on how we can make things better for patients and staff.
these are:
reducing the burden on our workforce, so they can focus on delivering care;
giving people the tools to access information and services directly;
ensuring information about people’s health and care can be safely accessed, wherever it is needed;
aiding the improvement of safety across health and care systems
improving health and care productivity with digital technology.
please click on the links below for further information about nhsx
http://www.acertus.co.uk/nhsx/index.html
https://www.nhsx.nhs.uk/about-us/what-we-do/
the role
the candidate will be part of the adult social care tech and data team and will work across projects focused on increasing access to technology and data opportunities for social care providers. our ambitions are to ensure that:
care providers have the basic technology infrastructure in place to support them to deliver effective care
care staff can access the information they need when they need it
care staff have the skills and confidence to use digital technologies where it can help to deliver care, or improve efficiency
care providers and local authorities can confidently invest in, adopt and scale technologies that are proven to improve care outcomes
commissioners of care have accurate and timely data to make decisions and plan ahead
main responsibilities will be:
· helping to ensure that the strategic direction and specific work activities of the team in technology and data are underpinned by analysis and evidence
· it project management of specific work activities
· leading specific it transformation projects
· supporting the wider team by analysing trends, helping inform prioritisation and alerting the team to trends
supporting the team in working with stakeholders across nhsx, dhsc and its albs, as well as external stakeholders the role will enable the graduate to apply their technical capability to strategy and delivery activities at a national level, enabling them to gain an understanding of the wider picture
the candidate
we are seeking a highly motivated candidate with a relevant degree (such as those in health, project management, business change or transformation, it, digital technology, data or informatics) and who has a keen interest in how digital transformation can make things better for nhs users and staff that we serve.
the successful candidate will role model our organisations values and behaviours by being open, respectful, collaborative and innovative. they will have exceptional attention to detail, promoting high standards in all that they do and be adaptable and flexible in meeting the fast-paced challenges that the portfolio entails.
previous experience in a similar role within health or the wider public sector environment would be an advantage but not essential.
skills and experience
experience of delivering effective technology transformation using modern technology;
analytical and problem-solving skills. you can apply analytical techniques to present a solution. you know about statistical methodologies and data analysis techniques.
proven it and mathematical skills. you have proven it and mathematical skills, demonstrated through relevant qualifications or work experience.
communication skills. ability to make complex and technical information and language simple and accessible for non-technical audiences both orally and in writing and to present authoritatively in formal and informal settings
development and application architecture experience, with knowledge of open source technologies
data management, modelling, cleansing and enrichment. you understand data sources, data organisation, cleansing and storage, in addition to conceptual, logical and physical data modelling.
quality assurance, validation and data linkage abilities. you know how to conduct data quality assurance, validation and linkage between datasets.
experience of and an interest in a range of technologies.
tools and languages. ability to use coding tools and languages (e.g. stata/sas/sql/r/python or equivalent)
understanding of agile project management and continual delivery techniques
if you are interested in the opportunity then please apply by uploading your cv and writing a cover letter of no more than 1000 words, detailing how you meet the skills and experience requirements as described above.
closing date: 27th september 2020
virtual assessment centre: to be held from 21st october 2020 onwards
please note we would encourage candidates to apply early as applications are reviewed on a rolling basis, and the position may be closed before the deadline should enough applications be received.
job types: full-time, contract
salary: from £32,933.00 per year
work remotely:
temporarily due to covid-19",2020-09-22,
JUNIOR DATA ENGINEER,ELASTACLOUD,LONDON,https://www.indeed.co.uk/company/Elastacloud/jobs/Junior-Data-Engineer-1199e817e4675fbd?fccid=71d66642f0bb51e2&vjs=3,None,"£25,000 a year","junior engineer the role
as a member of our engineering team you will be working with our customers to deliver modern data platforms and pipelines in azure utilising a range of disciplines spanning devops, software engineering, and data engineering.
you will utilise agile development methodologies to deliver high quality platforms, working alongside our business intelligence and data science teams, enabling our customers to drive new insight from their data, faster.
growing within elastacloud you will have the opportunity to learn from our existing team and help to mentor new starters within our organisation as your own abilities develop. you will also have the opportunity to participate in internal sessions where we collaborate, share ideas, and demonstrate new technologies and ways of working.
responsibilities
· develop and deploy data platforms and pipelines that support customers migration and growth into big data and azure
· understand and deliver on technical, business, and non-functional requirements
· build batch and streaming solutions to meet our customers’ demands
· create build a release pipelines to build, test and deploy platform components between multiple environments
· transform data within the platform, generating bronze, silver, and gold models of data
· work as part of an agile delivery team
· peer review your fellow engineer’s code, providing constructive feedback where appropriate
· develop your existing skills and learn new skills and technologies
key skills technical
· knowledge and practical experience in any of the following programming languages: c#, java, scala, python
· experience in working with databases using sql
· knowledge of agile methodologies
· knowledge of version control systems such as git
· any experience or knowledge of the following would be desirable, but not critical for applying for the role.
o cloud based technologies (e.g. azure, aws)
o big data processing tools such as spark, hadoop, hive, impala
o data oriented platforms such as spark or pandas
key skills non-technical
· a problem solver, enjoys a challenge and takes ownership of trying to find solutions
· act under own initiative to pick up new tasks on a project
· can demonstrate tenacity by voicing your opinions, but in a constructive and collaborative way
about us
as a microsoft gold partner for cloud and data platform analytics, we are passionate about delivering true intelligence to our customers’ data.
our teams are leaders in advanced analytics and are paving the way for cutting edge developments in ai and ml, and are unparalleled in the fields of azure architecture, power bi, sql, r, scala and python.
since elastacloud was founded in 2011, our profound technical expertise and focus on business outcomes has enabled us to undertake projects across a wide range of sectors where we have unparalleled experience. our team is currently split across our 3 offices
reference id: elastacloud graduate junior engineer
application deadline: 30/09/2020
expected start date: 20/09/2020
job types: full-time, permanent
salary: from £25,000.00 per year
benefits:
casual dress
company events
flexible schedule
sick pay
work from home
schedule:
monday to friday
work remotely:
temporarily due to covid-19",2020-09-22,
