Title,Company,Location,Link,Review,Salary,Description,Date Added,Applied
DATA ANALYST,HHGL LIMITED : TRADING AS HOMEBASE,MILTON KEYNES MK9 1SH,https://www.indeed.co.uk/rc/clk?jk=bfd03773208625b1&fccid=5faf08b320f9ee7a&vjs=3,3.6,None,"we currently have a number of brand new opportunity for a data analysts to join us at a period of significant growth here at homebase. working closely with various teams and involved in a number of activities which are crucial to the day to day running of the business.

this would be the perfect role for entry level candidates/graduates looking to progress into a career in buying/merchandising as these roles will be an opportunity for you to build the foundations of a successful career in within one of our fastest paced functions.

key responsibilities for this role would include:
clear, effective, and timely communication both internally with marketing, finance, trading, retail, and externally where applicable. ensure actions are planned effectively and challenges escalated and resolved
regular review of master data forms and processes, and recommend improvement thereof, to ensure they meet the needs of the business
update master data for all article change, and ad-hoc requests, in line with agreed procedures to ensure a first-class service is delivered to the business
proactively identify easier methods of working which would benefit the team and the business to reduce complexity
demonstrate an extensive knowledge of sap capabilities so the master data team is recognised as a centre of excellence to provide support to trading & trading finance
immediately escalate any risks or issues which would affect sap integrity or the customer experience in store
work with master data team colleagues to deliver business and team objectives
liaise directly with key contacts to ensure they are aware of any potential issues which may arise, whilst keeping the manager informed
to contribute where required to new system implementation and enhancements, this includes testing and training
provide out of hours support as required.
contribute in the event of a disaster, to participate in all functions of master data recovery as detailed in the recovery plan

about you:
you could already be working in a similar position or even be a recent graduate. what we are looking for are candidates who can demonstrate a high level of organisation, an intermediate level of expertise in microsoft office, specifically excel/spreadsheets and ideally some experience working within a retail environment.

at homebase, we have a strong culture of promoting from within. but you are in the driving seat and can take your career as far as you want to. it’s all in your hands. to progress your career with us, we will provide you will all of the tools and support you will need but ultimately your development is driven by your talent and passion to succeed.

we also offer a variety of additional benefits to compliment a competitive salary.",2020-09-24,0.0
DATA OFFICER,SOUTHEND-ON-SEA BOROUGH COUNCIL,SOUTHEND-ON-SEA,https://www.indeed.co.uk/rc/clk?jk=82cfbc9178d31a26&fccid=b0a00c06244d180f&vjs=3,4.0,£12.09 - £13.89 an hour,"office location
contract type
agency
role category
closing date
25-sep-2020
recruiter
salary
£12.09 - £13.89
your new organisation
southend-on-sea borough council is a unitary authority based in the heart of the town centre. this diverse and busy town has a great seafront, public parks and leisure activities, competitive house pricing and excellent travel links, accessible via two train lines from liverpool street and fenchurch street. it offers traditional seaside living that makes it a fantastic place to live and work.

the council delivers a wide range of vital services at the heart of the community, as well as investing in exciting and ambitious projects that keep southend-on-sea firmly on the map. the council has high expectations for the future and is working with local partners and local communities to ensure we deliver our exciting ambition for what the borough will be like by 2050.
your new role
we are looking for a data officer to join the operational performance & intelligence team on a full time, temporary basis (6 months). as a data officer, you will be responsible for the research, collection, processing and reporting of data. you will collate, analyse and report data to a high standard. you will assist with the collection of data through providing advice and support to specialist practitioners, such as social workers and teachers.
you will be responsible for supporting the monthly performance reporting processe. you will enable officers to make full use of performance information and ensure that up to date information is available for regular performance review.
what you'll need to succeed
to be successful in this role, it is essential that you have strong mathematical and statistical knowledge. you need to be able to accurately analyse and present numerical information in a user-friendly format, including use of graphical and visual methods. you will be liaising with senior officers, so it is essential that you are able to communicate and listen effectively.
this role will suit a recent graduate or someone who is looking to develop their data analyst skills. background in mathematics / statistics / engineering or another science base will be highly advantageous.
training will be given to develop skills such as sql, r and geospatial analysis
what you need to do now
if you're interested in this role, click 'apply now' to forward an up-to-date copy of your cv. if this job isn't quite right for you but you are looking for a new position with southend-on-sea borough council, please contact us on show phone number
for a confidential discussion on your career.

“please note: applications for this vacancy may close prior to the date advertised above. this will be dependent on the volume of applications received.”
the council is an equal opportunities employer. they welcome applications, regardless of race, colour, nationality, ethnic or national origins, sex, disability, sexual orientation, gender reassignment, marital or civil partner status, pregnancy or maternity, age or religion or belief. all applications will be considered solely on merit.",2020-09-24,0.0
DATA AND ANALYTICS - GRADUATE PROGRAMME,NATWEST GROUP,LONDON,https://www.indeed.co.uk/rc/clk?jk=b59f6fac91bdbd2c&fccid=4a3a2b1eb3ec0691&vjs=3,4.3,"£31,850 a year","about you
to be eligible for our data and analytics programme, you’ll need to have, or be on course to achieving a 2:1 in your degree
we’re looking for curious, inquisitive people who show a real passion for data and technology, and the drive to explore how it can be used to make a positive difference for our customers
you’ll bring strong problem-solving skills, along with an analytical approach and an appreciation of analysis techniques
about the programme
as a graduate trainee in data and analytics we’ll equip you with the knowledge, skills and experiences you’ll need to make a significant impact and become a leading data expert. you’ll learn about the ways we’re using data to drive changes and improvements to customer experiences, and challenge you to consider ethical issues and focus on keeping our customers’ data safe.
we’ll reward you with a starting salary of £31,850 a year. and on top of your salary, you’ll also have access to our flexible benefits package.
over the course of this two year programme you’ll:
learn the core technical skills needed to succeed as an analyst
interrogate, interpret and visualise large volumes of data
learn how to articulate complex situations and technical work to a non-technical audience
drive the use of data across the bank to ensure better customer engagement
build your confidence, and developing your influencing and stakeholder management skills
see first-hand how our data academy can help you develop a strong foundation in critical data skills, and provide the opportunity to master specialisms like data science and data engineering
about the business area
our data is one of our greatest assets, and how we harness it to understand the world, our business and our customers’ needs is crucial. in data & analytics, we promote the intelligent use of data and make sure it’s used in the right way.
good data engineering helps us get to grips with the data we have. and data science allows us to apply statistics, computer science and problem-solving skills together with strong research methods to test, learn and optimise machine learning powered decisions to help customers.
if you need any adjustments to support your application, such as information in alternative formats or special requirements to access our buildings, or if you’re eligible under the disability confident scheme please contact us and we’ll do everything we can to help.",2020-09-27,0.0
GRADUATE OPERATIONS SUPPORT ANALYST,SERCO GROUP,BIRMINGHAM B1,https://www.indeed.co.uk/rc/clk?jk=29a5c4b6ff670ec1&fccid=8177021cdb259d9d&vjs=3,3.5,None,"graduate operations support analyst
remote working, birmingham/hook
3 month ftc
£28,000
here at serco we’re helping the uk government address the challenges posed by coronavirus - and to actively support them in combating the spread of the disease we’re now recruiting for a graduate operations support analyst to support our testing services.
about you
first and foremost, you will be a university graduate who is keen to develop your career, with excel and data analysis experience. ideally you will also have some operational or commercial experience.
reporting to the contract director, you will lead in developing requested ad-hoc reports in response to business requirements including the use and/or development of an excel tracker to ensure tasks are tracked until completion.``
this role will also see you take on responsibility for the production of daily, weekly and monthly operational reports for performance, capacity and future mobilisation of test sites. you will also deliver agreed regular management information that drives serco’s strategy as well as providing support to the contract director and head of operations and plans in working with the dhsc. you will also lead in administrative support tasks and ad-hoc project requirements. finally, you will communicate regularly with site and regional managers to ensure complete and detailed capture of requirements for the operations and plans teams.
we ask that you have strong communication and interpersonal skills and be proficient in the use of microsoft office tools, particularly excel. we are looking for you to have experience of working in a fast paced environment and to be self-motivated and able to work independently.
this role is a remote working position with some travel to sites around england, so a clean driving licence is essential. travel expenses will be paid.
lastly, this role is exempt from the rehabilitation of offenders act 1974 and all offers of employment are subject to security clearance checks and approval by the home office.
why serco
meaningful and vital work: the testing roles are vital in protecting our employees and those entrusted to our care from harm; and ultimately helping to stop the spread of the virus.
a world of opportunity: our diverse uk-wide operations offer unrivalled opportunities to learn and develop. you’ll be able to broaden your experience and apply your skills in new ways in this completely new team.
great people: as well as care for our communities we also care for and support one another. we are a motivated team who will encourage you and help you to succeed.
about serco
at serco, not only is the nature of the work we do important, everyone has an important role to play, from caring for vulnerable people to managing complex public services. we are a team of 50,000 people responsible for delivering essential public services around the world in areas including defence, transport, justice, immigration, healthcare and citizen services. we are innovators, committed to redesigning and improving public services for the benefit of everyone.
by joining serco you will have unlimited access to our global employee networks – sercoinspire (gender), sercoembrace (multicultural), sercounlimited (disability) and in@serco (lgbt & networks). serco employee networks, led by colleagues who are passionate about diversity, inclusion and belonging.
apply
please click on the apply button to complete your application. occasionally we receive a large volume of applications for our roles and when that happens we sometimes bring the closing date forward, so please apply promptly to avoid disappointment.
we’re a disability confident employer and are committed to equal opportunities. if you have any additional queries, requirements or you need more time to apply, then please contact our recruitment team directly on show phone number
. disabled applicants who meet the minimum criteria for the job will be given the opportunity to demonstrate their abilities at an interview.
serco supports fair access to employment for those with unspent criminal convictions through the ‘ban the box’ pledge (some may be exempt due to the nature of the role and the security clearance required).
*google chrome is the preferred browser to access serco careers website*",2020-09-27,0.0
GRADUATE MARKET INTELLIGENCE ANALYST,ARM,CAMBRIDGE,https://www.indeed.co.uk/rc/clk?jk=3de08f940f1d713a&fccid=0110be8f148b4964&vjs=3,4.2,None,"we are an equal opportunity employer and do not discriminate against any employee or applicant for employment because of race, color, sex, age, national origin, religion, sexual orientation, gender identity, status as a veteran, and basis of disability or any other federal, state or local protected class.
job description
arm’s client line of business is responsible for all customer engagement activities at all levels of the value chain across the smartphone, pc and consumer market segments. we develop and execute strategies to grow the business, defines the right products and solutions, and ensure our customers are successful.

we are currently looking to recruit a graduate market intelligence analyst to join a team of highly-skilled professionals in analysing the company’s business environment and the markets we are competing in. you will play a pivotal role delivering information that helps support key business decisions and strategy. this is a superb opportunity for you to become part of a technology leader with ambitions for continuous growth and innovation.
what will i be accountable for?
supporting colleagues in the group by delivering insightful market specific reporting to the organisation.
transforming the way information is delivered by exploring new techniques and methods that help improve engagement and efficiency.
capturing data from across arm’s ecosystem to identify the underlying trends that are driving arm’s growth in each market.
combine internal data sources with third party reports to develop the understanding of where processor ip is being deployed and help identify new market opportunities.
support the planning process in maintaining a detailed model of arm's future revenues.
delivering robust solutions to data management issues and improving the standardisation and automation of reports.
job requirements
what skills, experience, and qualifications do i need?
essential:
experience in statistical, financial, economic, data analysis, or forecast modelling
highly comfortable and proficient working in excel, including create/use pivot tables
excellent communication and interpersonal skills
highly motivated and outcome driven
ability to learn quickly and a desire for continuous self-improvement
an enthusiastic approach with an appetite for creating change
desirable:
experience of tableau, power bi, or other business analytics tools
experience using sql and python to manipulate and analyse large and varied data sets
commercial awareness, with an interest in the technology industry
at arm, we are guided by our core beliefs that reflects our rare culture and guide our decisions, defining how we work together to defy ordinary and shape extraordinary.

we, not i
collaboration first, egos last.
start with long-term value to customers and partners, and work back from there.
collaborate, decide, commit, and bring people with you.
make the most of all the skills and knowledge across arm; share information with those who need it.
care about the people around you.

passion for progress
innovation that enables our ecosystems, arm and our people to thrive.
work with pace and judgement. adapt to circumstances.
take risk in support of arm's progress.
be accountable for the decisions you take. learn from failure.
pursue innovation relentlessly.

be your brilliant self
skilful individuality, performance and fulfilment.
be authentic.
seek and embrace differences.
encourage curiosity and challenge.
give people trust and autonomy; show people they can trust you to do brilliant work in pursuit of arm’s goals.

#li-fg1
benefits
your particular benefits package will depend on position and type of employment and may be subject to change. your package will be confirmed on offer of employment. arm’s benefits program provides permanent employees with the opportunity to stay innovative and healthy, ensure the wellness of their families, and create a positive working environment.
annual bonus plan
discretionary cash award
group personal pension plan with enhanced company contribution
medical, travel, health & life insurances
holiday, 25 days annual leave with option to buy an additional 5 days per year
sabbatical, 20 paid days every four-year of service
volunteering, one (1) paid working day each year (teamarm)
varies by location: cycle to work, free car parking, gym on site, team and social events
about arm
arm® technology is at the heart of a computing and connectivity revolution that is transforming the way people live and businesses operate. from the unmissable to the invisible; our advanced, energy-efficient processor designs are enabling the intelligence in 86 billion silicon chips and securely powering products from the sensor to the smartphone to the supercomputer. with more than 1,000 technology partners including the world’s most famous business and consumer brands, we are driving arm innovation into all areas compute is happening inside the chip, the network and the cloud.
with offices around the world, arm is a diverse community of dedicated, innovative and highly talented professionals. by enabling an inclusive, meritocratic and open workplace where all our people can grow and succeed, we encourage our people to share their unique contributions to arm's success in the global marketplace.
about the office
at our global hq in cambridge, england we house the majority of our engineering and our corporate groups that deliver our extraordinary success. as a world-renowned university town, cambridge boasts both a beautiful countryside and a historical town center. local activities include punting on the river cam and the many museums that reside within cambridge university.
cambridge, uk - global hq
arm ltd.
110 fulbourn road
cambridge
gb-cb1 9nj",2020-09-27,0.0
"ASSOCIATE ANALYST, MARKETING - MASTERCARD LAUNCH (2021 GRADU...",MASTERCARD,LONDON,https://www.indeed.co.uk/rc/clk?jk=00e2f569f64dd5b7&fccid=10b5c722d846df43&vjs=3,4.1,None,"our purpose
we work to connect and power an inclusive, digital economy that benefits everyone, everywhere by making transactions safe, simple, smart and accessible. using secure data and networks, partnerships and passion, our innovations and solutions help individuals, financial institutions, governments and businesses realize their greatest potential. our decency quotient, or dq, drives our culture and everything we do inside and outside of our company. we cultivate a culture of inclusion for all employees that respects their individual strengths, views, and experiences. we believe that our differences enable us to be a better team – one that makes better decisions, drives innovation and delivers better business results.
job title
associate analyst, marketing - mastercard launch (2021 graduate program)
who is mastercard?
we are the global technology company behind the world’s fastest payments processing network. we are a vehicle for commerce, a connection to financial systems for the previously excluded, a technology innovation lab, and the home of priceless®. we ensure every employee has the opportunity to be a part of something bigger and to change lives. we believe as our company grows, so should you. we believe in connecting everyone to endless, priceless possibilities.

the mastercard launch program is aimed at early career talent, to help you develop skills and gain cross-functional work experience. over a period of 18 months, launch participants will be assigned to a business unit, learn and develop skills, and gain valuable on the job experience. successful candidates will be assigned to a business unit within international markets and rotate for a duration of 2 x 9 months each for a total of 18 months.

do you:
do you want to be a part of a collaborative environment?
are you motivated to be a part of driving a world beyond cash?
are you motivated to stay on the cutting edge of technology?

the program:
a diverse experience within mastercard comprising exposure to functions such as core products, digital products, account management, market development, marketing and communications.
you will participate in a training program aimed at developing competencies in business acumen, leadership & interpersonal skills, and project management.
you will have the opportunity to work with your peers on various business projects which aim to provide enhanced work experience outside of your day-to-day role.
you will work with our dedicated leaders–successful managers and executives who inspire, mentor, and coach others toward successful careers here at mastercard.

what you need:
strong verbal and written communication skills
analytical and problem solving skills
strong strategic and conceptual aptitude
excellent interpersonal skills
ability to multi-task and prioritize multiple projects concurrently
experience in market research, including qualitative and survey-based research
advanced excel skills and knowledge of statistical analysis
interest in human behavior, regional consumer culture, and insight development
must be a final year student or recent graduate within 12 months
minimum predicted classification of a 2.1 or equivalent gpa of 3.2
languages: english required & an additional languages a plus
due to covid-19, most of our employees are working from home. we’ve implemented a virtual hiring process and continue to interview candidates by phone or video and are onboarding new hires remotely. we value the safety of each member of our community because we know we’re all in this together.
mastercard is an inclusive equal employment opportunity employer that considers applicants without regard to gender, gender identity, sexual orientation, race, ethnicity, disabled or veteran status, or any other characteristic protected by law.
if you require accommodations or assistance to complete the online application process, please contact reasonable.accommodation@mastercard.com and identify the type of accommodation or assistance you are requesting. do not include any medical or health information in this email. the reasonable accommodations team will respond to your email promptly.",2020-09-27,0.0
BUSINESS INTELLIGENCE ANALYST,NORTH SOMERSET COUNCIL,WESTON-SUPER-MARE,https://www.indeed.co.uk/rc/clk?jk=2f10a1156e77eb78&fccid=61e5658e3b572f95&vjs=3,3.8,"£28,672 a year","job description
job description jg5
job description jg6
job description jg7
hours: 37 hours per week
contract: permanent

do you have an interest in data and analysis, either through your studies or through your work history?

north somerset council is recruiting a new team member for our business intelligence service. the service covers everything from data collection to data analytics to performance reporting. whether you’re a recent graduate or someone looking for a new challenge, we welcome people from a variety of backgrounds.

we offer training across our various systems and software including excel, sql and power bi. we also offer a friendly, flexible working environment, and a career grading system which encourages progression through the service.

you’ll need to come to us with a love of numbers and a curiosity for understanding what those numbers mean.

if this sounds like a good fit, we’d love to hear from you.

want to know more and apply?
for an informal discussion, please contact abby murphy, senior business intelligence analyst on show phone number
.

visit www.n-somerset.gov.uk/jobs to download an application pack and apply online.

anticipated interview date: monday 12 october 2020

north somerset council is an equal opportunities employer. we welcome applications from all sections of our community regardless of age, disability, sex, race, religion, belief or sexual orientation. north somerset council is committed to safeguarding and promoting the welfare of children and young people and expects all staff and volunteers to share this commitment.",2020-09-27,0.0
